<?xml version="1.0" encoding="UTF-8"?>
<xs:schema xmlns:xs="http://www.w3.org/2001/XMLSchema">

    <xs:simpleType name="dosDecimales">
        <xs:restriction base="xs:decimal">
            <xs:fractionDigits value="2"></xs:fractionDigits>
        </xs:restriction>
    </xs:simpleType>

    <xs:element name="nombre"></xs:element>
    <xs:element name="apellidos"></xs:element>
    <xs:attribute name="dni" type="xs:string"></xs:attribute>
    <xs:attribute name="nota" type="dosDecimales" ></xs:attribute>
    
    <xs:element name="alumno">
        <xs:complexType>
            <xs:sequence>
                <xs:element ref="nombre"></xs:element>
                <xs:element ref="apellidos"></xs:element>
            </xs:sequence>
            <xs:attribute ref="dni"></xs:attribute>
            <xs:attribute ref="nota"></xs:attribute>
        </xs:complexType>
    </xs:element>

    <xs:element name="alumnos">
        <xs:complexType>
            <xs:sequence>
                <xs:element ref="alumno" maxOccurs="unbounded"></xs:element>
            </xs:sequence>
        </xs:complexType>
    </xs:element>
</xs:schema>